nameEn,nameKo,descriptionEn,descriptionKo,type,categoryEn,categoryKo,videoId,participants,conferenceYear,imageIdx,imageCnt
A midsummer Night’s Snow,한여름 밤의 눈,"A girl living in the world of summer got a hobby to collect the fashion calendar with four seasons. She has a dream to live in the country with four distinct seasons. She dolls herself up like a model in the calendar, imagining about the four seasons in her own way to satisfy her romantic ideas about ‘the country with four seasons’, but she soon reaches the limitation in winter the last season. 
Can the girl realize her dream of ‘A Midsummer Night’s Snow?’
As the only producer, there were no little hardships proceeding the work and solving problems every time on my own. Over a year of production period, I sometimes experienced slumps, but I got encouraged by the girl in the story and could be able to get out of it. The girl struggling to realize her own fantasy made me to strengthen my determination to complete my work. Perhaps it might be because whenever I could not proceed the work anymore, the girl in the screen staying as same pose for days made me felt bad for reminding myself.
Some people say it is foolish to have a dream which is nearly impossible in reality like waiting for A Midsummer Night’s Snow. However, like the girl and the boy of my story achieved their dreams, I hope the young who are in loss of their dreams in these days could get the message that it is not everything to give it up just because it seems impossible to some people through this work.","일 년 내내 여름인 나라에 사는 소녀는 사계절 패션 달력을 모으는 것이 취미다. 그 소녀에게는 사계절의 구분이 뚜렷한 곳에서 살고 싶은 꿈이 있다. 소녀는 달력 속 모델들처럼 꾸미고 자기 나름대로 사계절을 상상하면서 ‘사계절이 존재하는 나라'에 대한 로망을 채워나가지만, 마지막 계절인 겨울에서 곧 한계에 부딪히게 된다. 
과연 소녀는 ‘한여름 밤의 겨울'을 이룰 수 있을까? 
일인 제작자로 처음부터 끝까지 모든 과정을 진행하고 수시로 문제점을 해결해야 했기에 적잖은 어려움이 있었던 작품이다. 1년 가까운 제작 시간 동안 때로 슬럼프에 빠질 때도 있었지만, 그때마다 힘을 준 것이 이야기 속 소녀이다. 소녀가 자신의 환상을 이루기 위해 노력하는 모습을 보며 나도 작품을 반드시 완성해야겠다는 각오를 다질 수 있었다. 어쩌면 더는 능률이 오르지 않아 작업을 진행하지 못하고 있을 때 며칠이고 같은 자세로 서 있는 소녀가 나를 보는 것 같아 안쓰러웠기 때문일지도 모른다. 
여름 밤에 눈이 내리는 것처럼 현실적으로 불가능해 보이는 꿈을 가진 이에게 일찌감치 포기하는 것이 현명한 행동이라고 조언을 하는 사람들이 있다. 하지만 작품 속의 소녀와 소년이 작게나마 소녀의 꿈을 이룬 것처럼, 꼭 포기하는 것만이 능사는 아니란 것을 요즘 꿈을 잃어가는 청춘들에게 작품을 통해 말하고 싶었다.",EXHIBITION,Film,영상,ObreczWbrs4,박민경,2016,23,2
Level Up Showcase,Level Up Showcase,"Level Up is a society of the creation and study of VR game contents. Beginning as a Small Creator Group of Sogang University, Department of Art&Technology major on March, 2015, Each member of Level Up has been working on game production with pleasure for two years.
The title of the contents to exhibit in 2016 ATC is <Shopping Cart>. <Shopping cart> is a casual game that the player should get to the final destination of counter in time, with their products on the shopping list put correctly into the cart. 
The background of the game is an ordinary market with shopping carts, and there are two shelves full of products on both sides of the player. When the game begins, a shopping list of needed products will be shown to the player. The biggest goal of the game is to ‘grab and put’ every product written on the shopping list into the cart. If safely get back to the counter with a cart ‘without any trouble’ in time, then the player will get a high score. 
The player should GRAB each product carefully, because if the player could not make a detailed control when grabbing the product, other products nearby also come along to the cart. The player can also put them back to the shelf, but we wonder if there would be enough time for the players to do so. Every product in the cart should be counted as scores when arrived at the cashier, and the player will get minus points for the unwanted products. 
Level Up has been considering the contents to make the best use of medium characteristics only VR can have. We’re planning contents with diverse topics including 360 viewing angle and room-scale VR, and <Shopping Cart> is especially for making the public to be closer with VR controller.","Level Up은 VR 게임 컨텐츠 연구·제작 학회로, 2015년 3월에 Art&Technology학과 소속의 Small Creator Group으로 시작하여 2년째 즐겁게 게임을 만들어 나가고 있습니다.
2016년 ATC에 출품한 컨텐츠의 이름은 <Shopping Cart>입니다. <Shopping Cart>는 마트에서 정해진 시간 안에 쇼핑 리스트의 물건들을 카트에 잘 담아 목적지(계산대)까지 도착해야 하는 캐주얼 게임입니다.
배경은 쇼핑카트를 끌 수 있을 만한 규모의 마트로, 양 옆에는 물건으로 가득한 진열장이 있습니다. 게임을 시작하면 사야 하는 물건이 표시된 쇼핑 리스트가 나옵니다. 플레이어는 이 쇼핑 리스트에 적힌 물건과 진열장에 있는 물건의 이름을 잘 파악하여 물건을 잡아 카트로 넣어 무사히 목적지인 계산대까지 도착하면, 높은 점수를 얻을 수 있습니다.
물건을 잡다가 세세히 컨트롤을 하지 못하면 주변의 물건까지 건드려 카트 안으로 딸려 오게 됩니다. 카트 안으로 들어온 물건은 다시 가져다 놓을 수 있지만, 여러분께 그럴 시간이 과연 있을지 모르겠습니다. 계산대에 도착 했을 때 카트 안의 물건은 무조건 계산해야 하며, 필요치 않은 물건을 계산할 시 점수가 깎입니다.
이처럼 Level Up에서는 VR만이 갖고 있는 매체적 특성을 잘 활용할 수 있는 콘텐츠가 무엇일지 고민하고 있습니다. 360°의 시야각, room-scale VR 등 다양한 주제로 컨텐츠를 기획하고 있는데,  <Shopping Cart>는 특히 대중이 VR게임 컨트롤러와 친해지기를 바라는 마음에서 기획하였습니다.",SHOWCASE,VR,Virtual Reality,A5jj9xYetKg,"박성은,이다영,정다은,조은비,최하은",2016,A,7
Future Dining,Future Dining,"Today interest in food is increasing day by day. This is due to the fact that the meaning of food has changed from the basic concept of filling oneself to establishing a better relationship with others and increasing the quality of life. 
Using the concepts of 'food' and 'meal' which are closely linked to the lives of people today we planned our project 'DIETABLE' in order to offer people a more entertainable life and generate easier and efficient meal times. Based on the diverse categories related to food we focused mainly on appetites. We especially concentrated in developing     eating utensils that can increase or decrease appetites helping people who have lost their appetites or want to lose weight. Our aim is to create a content that can be useful to these people.
","음식에 대한 관심이 날로 높아지고 있는 요즘이다. 이는 과거 단순히 배를 채우는 용도로만 여겨졌던 식사의 개념이 이제는 다른 사람과의 관계를 구축하고, 더 나은 삶을 만들어주는 좋은 소재가 되었기 때문이라고 볼 수 있다. 우리는 사람들의 일상에 밀접하게 자리하고 있는 ‘음식’, ‘식사’라는 컨텐츠를 활용하여, 사람들에게 보다 엔터테인먼트적인 삶을 제공하고, 편리하고 유용한 식사시간을 만들어주고자 하는 의도로 ‘DIETABLE’을 기획하였다. 작년에 같이 진행하였던 졸업창작프로젝트 ‘따뜻해 밥상’은 미디어 아트적인 개념에서 식사 문화에 접근하였다면, 이번에는 실용성있고, 사람들에게 직접적인 영향을 줄 수 있는 컨텐츠를 만들어보고 싶었기에 제품 프로토타입 제작으로 큰 방향을 잡았다. 식사와 관련된 많은 카테고리들 중, 특히 식욕에 집중하여 식욕을 증진시키고, 억제시키는 식사 도구를 만들어 입맛이 없거나, 체중조절을 원하는 사람들에게 유용하게 쓰일 수 있는 컨텐츠를 만들고자 하였다.
DIETABLE 은 식사라는 뜻의 DIET 와 식탁이라는 뜻의 TABLE 의 합성어이며, 또한 효율적인 식사가 가능하다는 Diet ‘able’이라는 뜻을 내포하고 있다. 음식에 대한 인류의 관심은 유구한 역사동안 지속되어 왔으며, 현재는 단순히 음식을 먹기위한 1 차원적인 접근이 아니라 심리학, 뇌과학 등과 결합되어 새로운 분야를 창출해내고 있다. 그 중 하나인 미식 물리학은 음식을 먹을 때 사람들의 심리적 요인을 분석하고 이에 따라 식사량을 증진시키거나 감소시키는 학문인데. 우리는 이러한 학문적 연구로부터 인사이트를 얻어 식사량을 조절하는 각각의 방법을 활용한 프로젝트를 제작하였다.",SHOWCASE,Product Prototype,시제품 제작,A1GCmAPj628,"김수현,권정연",2016,B,6
Doo Doom Chit,두둠칫,"All you need is ""DANCE""!
'DooDumChit' is named after the dancing emoji. We create an easy-to-mimic ‘tap dance’ rhythm game contents for not only for those who enjoy dancing, but for everyone. 
Tap dance is derived from the large log called clog in Ireland and  it has developed independently with the fashion of jazz music in the 1920s. The key point of the dance is to make a sound of quick light footstep made through the tap between the iron heel on the front and back of the shoes and the floor. People who often feel embarrassed about their body moves can enjoy the dance casually because tap dance does not focus on its movement, but the sound.
Since the tap shoes, which are the major parts of tap dance are quite difficult to buy and expensive, we tried to modularize the iron heel called gong attached under the shoes so that multiple users can enjoy the dance together with one shoes. 
All the users need to do is just to wear modularized tap shoes and move their bodies with the rhythm of the music along the icon appears on the screen. The score is calculated depending on the accuracy and you can compete with multiple people who participated in DooDumChit. Wearing module and dancing step by step, you will be able to find yourself riding on new rhythm with noticing yourself to be. If you move your body slightly to fit the movements of your feet, it will give much more fun when you 'DooDumChit’.","All you need is ""DANCE""!
'두둠칫'은 춤추는 이모티콘에서 따온 이름입니다. 춤을 즐기는 사람뿐만 아니라 어색해 하는 사람들도 쉽게 따라할 수 있는 ‘탭댄스’를 리듬 게임의 형태로 컨텐츠를 제작했습니다. 탭댄스는 아일랜드의 클로그(clog)에서 유래하여, 1920년대 재즈 음악의 유행과 함께 독자적으로 발달했습니다. 신발 아래 앞, 뒤로 달린 쇠 굽이 바닥과 맞닿으며 경쾌한 소리를 내는 게 핵심입니다. 동작이 아니라 소리가 중심이 되는 춤이기 때문에 몸을 움직이는 게 어렵게만 느껴졌던 사람들도 부담 없이 즐길 수 있습니다.
탭댄스의 핵심이 되는 탭슈즈는 구하기 어렵고 꽤 가격이 나가기 때문에, 여러 사용자가 함께 할 수 있도록 슈즈 아래 달린 쇠굽(징)을 모듈화 했습니다. 사용자는 모듈화 한 쇠굽을 본인의 신발에 착용하고 화면에 보이는 아이콘과 음악의 리듬에 맞춰 발을 움직이면 됩니다. 정확도에 따라 점수가 계산되고 ‘두둠칫’에 참여한 여러 사용자와 등수를 겨뤄볼 수 있습니다. 모듈을 착용하고 한 발 한 발 내딛다 보면 어느 새 리듬을 타고 있는 자신을 발견할 수 있을 것 입니다. 발의 움직임에 맞춰 조금씩 몸을 움직여 주면 훨씬 더 재밌게 ‘두둠칫’하실 수 있을 것입니다.",SHOWCASE,Interactive Game,인터렉티브 게임,hHug-xS86ds,"김수현,박영우,장윤정",2016,C,18
NoticeMe,NoticeMe,"NoticeMe.
Journey to the heart of the other world. Meet hilarious, fantastic new creatures.
In our mobile game “NoticeMe”, you need to distinguish, and make yourself the most unique one among all the others. Customise yourself with different parts, be the most unique one, and mingle with others. Main character, “me”, is so unconfident about appearance, and always looking others through the window, hoping to be with them. Me, then stand with the others after dressing me up to be the most attractive one, craving to be loved. How uniquely you decorate the main character will make you be praised and clear the stage, because this is how the “coolest” world of loving difference works!
It might be the same old story, but we are always afraid of revealing our true selves in front of the others. Of course we all know it’s nothing to present ourselves in minds, but it’s still hard to take off the mask and face the true me. The main character also feels lonely alone, but soon put on a mask to move forward the new world and meet others. What we, creators wanted to say through this game is that it is just okay to love both the masked me and the true me. You’re beautiful just the way you are. And your efforts to be a better “me” is also lovely enough.","NoticeMe, 나를 봐주세요.
NoticeMe는 특성을 조합하여 특이한 존재 중에서 가장 눈에 띄게 하는 모바일 퍼즐 게임이다. 자신이 없는 주인공은 창밖으로 다른 이들의 모습을 관찰한다. 다양한 파츠를 입고, 가장 눈에 띄는 캐릭터가 되도록 꾸며서 그들 사이에 선다. 그렇게 해서 다른 이들에게 사랑받고 싶어 한다. 매 스테이지마다 새로운 모습의 존재들 사이에서 가장 눈에 띄기 위해서 다양한 파츠로 주인공을 꾸며볼 수 있다. 얼마나 독특하게 주인공을 꾸몄느냐에 따라 칭찬을 듣고, 스테이지를 클리어할 수 있다. 여기는 자신과 다름을 사랑하는 그런 쿨한 세계니깐!
조금 뻔한 이야기일지도 모르지만, 사람은 누구나 자기 자신을 완전히 드러내기를 두려워한다고 생각한다. 많은 이들은 가면을 쓰지 않은 자신 또한 사랑받을 수 있다는 것도 알고 있지만, 마음속 깊이 이해하기 어렵다. 게임 속 주인공 또한 홀로 외로워하다가 다른 이들을 만나기 위해 단장을 하고 밖으로 나간다. 이 게임을 통해서 네가 아닌 네가 되는 그 노력도, 꾸미지 않은 그대로의 너도 괜찮은 것이라고 말해주고 싶다.",SHOWCASE,Game,게임,_2oVH-uE-Io,"이다영,홍소희",2016,D,4