nameEn,nameKo,descriptionEn,descriptionKo,type,categoryEn,categoryKo,videoId,participants,conferenceYear,imageIdx,imageCnt
殘,殘(잔),"We are the beings that always see something. Everytime we observe something continuously but there is the thing that we can’t see completely itself: myself. Therefore, we care about view from others which only can see the outside of myself totally. We look at the mirror eventhough we already know that we can’t see the essence of ourselves.
The shape reflected in the mirror looks real but it is even much cruel “illusion” that resembles our reality. We already know that but we are decaying that fact and maybe we are compromising with the illusion.
‘殘’ is trying to make our sight turn from the outside to inside. The strong light, which is enlightened in front of the fake regarded as the real, makes us blind.  Close your eyes and Face the time that you should have had once.","우리는 보는 존재다. 우리의 눈은 무언가를 끊임없이 관찰하지만 절대 온전히 바라볼 수 없는 존재가 있으니, 그건 바로 나 자신이다. 그래서 나 자신을 그대로 볼 수 있는 다른 눈들에 신경 쓰고, 진짜 모습을 볼 수 없다는 것을 알면서도 우리는 거울을 본다.
거울에 비친 상은 진짜인 듯 하지만 오히려 현실과 닮아 더욱 잔인한 ‘환상'일 뿐이다. 심지어 우리는 우리가 그것을 알고 있다는 사실조차도 망각한 채로, 그 환상과 타협하고 있는지도 모른다.
‘殘(잔)'은 이러한 우리의 시야를 겉모습이 아닌 내면의 모습으로 돌리려 한다. 진짜라고 여겨졌던 가짜의 모습 앞에서 비춰지는 강한 빛은 오히려 우리의 모습을 보지 못하게 만든다. 우리는 눈을 감고, 강한 잔상과 함께 한번쯤 가졌어야 했던 시간을 갖는다.",EXHIBITION,Media Art,미디어아트,DDFesk-RvNs,"박채린,정도영",2016,11,3
Fourteen,Fourteen,"The work consists of 14 pairs of photos and drawings arranged  in parallel. The cooperation was done by one artist taking a photo of 14 pictures, and the other artist drawing 14 illustrations. The interesting point to focus on for this work can be the ‘friction’, and the topic ‘fantasy’ is being converged into the point where this frictional sound occurs.
Then where would the frictional sound be originated from. It would be the place where the different methodology of photo and drawing by two artists branches off.
The ontology and virtue of photographic image that it can only be taken as first person view are at where we can illustrate the beginning of the record case that the photographer encounters the worldly third person. At the moment, by observing the formative object reborn to the subject of reproduction, the audience notices not the material property of the subject itself, but the eyes of the artist. Looking at the uncertain indicators captured by the eyes, the audience is witnessing the incarnating moment of transcendent movement that cannot be incorporated into the order of mimesis.
The aesthetics of painting is ultimately similar to this point. It remains in the process of replacing the space of secular materialisms controlled by the formal logics like perspective to the subjective stroke of the artist’s own by escaping from the subordination of reappearance. That is, two methodologies sharply different from its surface layer intersects at the point where they integrate the marks of their own gazing towards matters. The motif to flow through <Fourteen> exactly remains in the dialectic area of these methodologies of two different medias rub together. Each note perform a contrapuntal ensemble piece in the mind of the audience facing this parallel arrangement of the work and meet leap to the next level. “Illusion” of <Fourteen> lies in the non-visible space where the gazing of two intimate formative arts intersect with each other.","작품은 병렬적으로 배치된 14쌍의 사진과 그림으로 구성되어있다. 두 작가중 한 명이 14장의 사진을 찍었으며 나머지 한 명은 14장의 드로잉을 그리는 것으로써 공동 제작에 참여했다. 작품의 관전 포인트는 ‘마찰’이라 거론될 수 있을 것이며 “환상""이라는 주제 또한 그 마찰의 파열음이 발생하는 지점으로 수렴하고 있다.
그렇다면 그 마찰음의 발원지는 어디인가. 그것은 두 작가가 차용한 사진과 회화라는 상이한 방법론이 갈라지는 장소이다.
1인칭 시점으로 촬영될 수 밖에 없다는 사진적 이미지의 존재론이자 미덕은 카메라라는 접점을 통해 촬영자가 세속적 타자와 조우하는 기록적인 사건의 발단을 예증할 수 있다는 지점에 있다. 이 때 재현의 대상으로 거듭난 조형적 형상을 바라보며 관객은 피사체 그 자체의 물성이 아닌, 예술가의 시선을 감지한다. 그 시선속에 포착된 불투명한 지표들을 바라보며, 관람객은 미메시스의 질서로 편입되지않는 초월적인 운동이 육화하는 순간을 목도하는 것이다.
회화의 미학도 궁극적으로는 이와 유사하다. 그것은 재현의 예속에서 탈주함으로써 원근법과 같은 형식논리들이 관장하는 세속적 물질성의 자리를 작가만의 주관적인 필치로 치환해가는 과정속에 자리한다. 즉, 표층에서 현격한 차이를 보이는 두 상이한 방법론은 사물에 대한 제각각의 응시의 흔적을 집약시킨다는 지점에서 교섭한다. <포틴>을 관류하는 모티브는 바로 정확히 이 두 가지 상이한 매체들의 방법론이 마찰하는 변증법의 영역에 자리한다. 각각의  선율은 작품의 병렬적 배치를 마주한 감상자의 마음속에서 대위법적으로 합주하며 다음의 층위로 도약한다. 곧, <포틴>의 “환상”이라함은 밀접한 두 조형 예술의 응시가 교차하는 비가시적인 공간에 기거하고있다.",EXHIBITION,Installation,설치,L5VKbjHRoiw,"김신,김시준",2016,12,5
Memory Horizon,Memory Horizon,"“See the Unseen.”
Memory is a collective term of a psychic function to cause impression, perception, and conception, which refers to the phenomenon that a human or an animal storing what they have experienced into the specific term and reproducing or restructuring them later. Our memory exists under the surface of consciousness, entered as a fragment with individual keywords, and restructured with their own special story at the very moment of printing it out. We all destroy the wall between the past and the present through the active  process of cognitive force called memory and experience the transcending moment beyond the dailiness as a dasein. 
Memory Horizon intends to express the beauty of memory crossing the reality and the fantasy through the stereoscopic spatialization by rediscovering the aesthetic value embedded in the attribute of ‘memory’ as a process of storing and revealing of the experimental past.
The mechanical movement of a clock located in the center of the space reveals the limitation of horizontal dimension of time and at the same time physically indicates the mediating energy emitted on the border of existence and non-existence. As a main agent with a fragment of memory of their own and externalizing its subconsciousness, and as a creator of the new story, the audience is constructing a new meaning to the un-daily space of the work. 
We’re expecting Memory Horizon to exist as a field of experiencing special multisensory space by projecting the archetypal beauty of memory.","“See the Unseen.”
기억이란 인상, 지각, 관념을 유발하는 정신기능의 총칭으로, 사람이나 동물이 경험한 것을 특정 형태로 저장하였다가 나중에 재생 또는 재구성하는 현상을 일컫는다.  우리의 기억은 각각의 키워드를 가진 채 조각으로 입력되어 의식의 표면 아래에 존재하고 있으며, 그것을 인출해 내는 현재의 시점에서 각자의 특별한 스토리와 함께 재구성된다. 우리는 누구나 기억 이라는 능동적인 인지작용의 과정을 통해 과거와 현재의 벽을 허물며, 현존재로서 세계의 일상성을 초월하는 경험을 한다.
이 작품은 경험적 과거가 보유 및 발현되는 과정인 ’기억’의 속성에 내재하는 미적 가치를 재발견하여 입체적으로 공간화함으로써, 현실성과 환상성을 넘나드는 기억의 아름다움을 표현하고자 하였다.
공간의 중심에 위치한 시계의 기계적 움직임은 수평적 차원의 시간이 갖는 한계성을 드러냄과 동시에 현존과 비현존의 경계에서 발산되는 매개적 에너지를 물리적으로 나타내고 있다.
저마다의 기억의 파편을 간직하며 그것의 잠재를 표면화하는 주체로서, 그리고 새로운 이야기의 크리에이터로서, 관람객은 작품 속 탈일상적 공간에 의미를 부여한다.
Memory Horizon이 기억의 원형적인 아름다움을 투영함으로써 특별한 공감각적 경험의 장으로 실재하기를 기대한다.",EXHIBITION,Interactive Installation ,인터렉티브 설치,E8kHaQMUkW4,"박선우,한소영",2016,13,6
CAVE,동굴,"The artists unfold their fantasy in an immersive virtual space. The audience walks around, observing and interacting with the virtual world.",몰입형 가상 공간에서 작가들의 환상을 풀어낸다. 관객은 걸어 다니고 둘러보며 이 가상 세계를 관찰하고 그와 상호 작용 한다.,EXHIBITION,Interactive Media Art,인터렉티브 미디어 아트,UDYepnzpD4s,"곽선근,이다은",2016,14,2
Illuminator,Illuminator,"“Fantasy on your mind”
The second work of PKW X JYJ Illuminator began under the motto to wake people’s senses of illusion. Facing the stairs surrounded by the unknown darkness, what do you expecting for? Inside the space that everyone feels differently about, the fantasy is blooming. Sensual images stimulate your visibility, and mysterious music evokes your imagination.The stair you step up is making the illusion you want.
Before passing through the hallway, please draw your own story about fantasy you expect on the prepared little post-it. And please share that little secret in the dark space where only you can find out. Illuminator, will be an enlightener full of lights and will blow illusions to your daily life. Walk through the stairs connecting the 4th and 5th floors of the exhibition and Find your own illusion.
Made by PKW Composed by JYJ","“Fantasy on your mind”
PKW X JYJ의 두 번째 작품 Illuminator는 환상에 대한 오감을 깨워주겠다는 모토로 시작되었습니다. 알 수 없는 암흑으로 둘러싸인 계단, 당신이 기대하고 있는 것은 무엇인가요? 모두가 다르게 느끼는 공간, 그 속에서 피어나는 환상. 감각적인 영상은 시각을 자극하고 새로운 음악은 상상을 불러일으킵니다. 당신이 걷는 길이, 곧 당신이 보고자 하는 환상을 만들어냅니다.
통로를 지나가기 전, 당신이 기대하는 환상에 대해 이야기를 준비된 작은 포스트잇에 그려내주세요. 그리고 어둠 속에서 찾아낸 당신만의 공간에 그 비밀을 공유해주세요. Illuminator, 빛으로 가득 찬 계몽자가 되어 당신의 일상에 환상이라는 숨을 불어 넣어드립니다. 4층과 5층 전시장을 이어주는 계단을 내딛으며 나만의 illusion을 찾으세요.
Made by PKW Composed by JYJ",EXHIBITION,Installation Media Art,설치 미디어아트,Xt1Ncf5BuZ0,"박건우,서재원,장윤정",2016,15,10
PROXY,PROXY,"As seen from Charlie Chaplin’s ‘Modern Times’ in 1936 or the novel ‘1984’ by George Orwell, the diagnosis for the modern human being has already been given long time ago. However, it is hard to say ourselves living in nowadays Korean society recognize this old diagnosis. ‘Proxy’ contains the contemplation towards the human being. It casts questions where the existences are orginated from and where they are heading to, and if the identity of an individual consists of the mere memory. Hope this project can be the shocking diagnosis to many people like a bomb.","1936년에 나온 찰리 채플린의 영화 ‘모던타임즈’나 1948년에 나온 소설 ‘1984’을 보면 이미 현대인에 대한 진단은 오래전부터 내려졌다. 그러나 오늘의 한국 사회를 살아가는 우리들이 그 오래된 진단을 인지하고 있다고 말할 수 있을까. ‘프록시’는 인간의 존재에 대한 고찰을 담고 있다. 존재가 어디서 오고 어디로 가는지, 그리고 개인의 정체성은 기억으로 이루어지는가를 묻고 있다. 이 프로젝트가 많은 사람들에게 마치 폭탄과 같은 충격의 진단이 되기를 바란다.",EXHIBITION,Book,책,icsTP9Tk3l0,김진수,2016,16,2
Daillusion : The Sogang,Daillusion : The Sogang,"Fantasy of the Routine And The routine of the Fantasy
As Sogang University to be its background, We set our goal to make a harmonized graphic artworks between storytelling photographing and digital media arts based on time lapse, time gap, and other various changes.
The new fantasy found from everyday life we pass through enables the observer to open the new eye.
The ripple began from the eye spread to the brain and will know your heart as fantasy.
As you get over from the fantasy, you then realize the space of the fantasy was your normal life.
The routine became the fantasy and the fantasy is your routine.
We make an artwork that can transform your routine in Sogang University to Fantasy.","Daily + illusion = Daillusion.
일상속의 환상 그리고 환상속의 일상.
서강대학교를 배경으로 하여 타임랩스, 시간차, 다양한 변화를 기본으로 한 그래픽아트 작품으로 스토리텔링 포토그래핑과 디지털미디어아트의 조화를 목표로 했다.
우리가 매일매일 스쳐 지나왔던 일상 속에서 찾는 새로운 환상은 관찰자로 하여금 다른눈을 뜨게 해준다.
눈으로부터 시작된 그 물결이 뇌를 지나쳐 환상을 만들어 심장을 두드린다. 
그리고 그 환상에서 빠져나올때쯤이 되면 자신이 빠져있던 그 환상의 공간은 일상이였다는 사실을 깨닫는다.
일상이 곧 환상이 되고 환상이 곧 일상이기 때문이다.
우리는 서강대학교의 일상을 환상으로 바꾸는 작품을 만든다.
",EXHIBITION,Photography+Digital Media Art,포토그래피+디지털 미디어 아트,pD7lzpjNcUI,"박건우,최근우",2016,17,5
Fantasia,Fantasia,"“Fantasy is created by you, and destroyed by you.”
This artwork shows the attribute of fantasy. The person who was tempted by the fantasy tries to get closer to it. However, at that time, the fantasy loses its form and breaks down. By the ‘recognition’. Ironically the fantasy is created in the idea of someone, but also the fantasy is ruined by same person when he tries to touch it.
When audiences get into the foggy space, they will meet a cube frame with the laser. The shape of laser light shining in fog shows an image of fantasy abstractly. When audiences come close to see the artwork, lasers vibrate, then the shape loses its original form.
Media artist group ‘ANTS’ wants to tell about the relationship between fantasy and recognition with this artwork.
","“환상은 당신에 의해 만들어지고 동시에 당신에 의해 파괴된다.” 
이 작품은 그러한 환상의 속성을 보여주는 작품이다. ‘환상’에 현혹된 사람은 그것을 소유하고 싶다는 ‘욕망’에 사로잡혀 거리를 좁히게 되고, 그 순간 사람의 ‘인지(認知)’로 인해 환상은 형체를 잃고 부서져 버린다. 나의 관념 속에서 만들어진 산물이지만 그것을 범하려는 순간 훼손되어버리는 것이다.
관객이 공간 안에 들어왔을 때 처음 마주하는 건 공간을 가득 채운 안개와 큐브, 그리고 큐브 안에서 교차되는 레이저 빛들이다. 안개 속에서 빛나는 레이저의 조형은 환상의 모습을 추상적으로 보여준다. 관객이 작품을 보고자 접근하는 순간, 큐브 안쪽을 비추던 레이저는 빠르게 진동하며 원래의 형체를 점점 잃어간다.
미디어아티스트그룹 ANTS는 환상과 인지의 관계에 대해 이야기하고자 한다.
",EXHIBITION,Installation Media Art,설치 미디어아트,b0CbloN0OFc,"김도균,김태훈,조남준,현준호",2016,18,7
And there existed desires at the beginning,태초에 욕망이 있었다,"“Go on, my dear,"" urges the snake. ""Take one. Hear it? 'Pluck me,' it's saying. That big, shiny red one. 'Pluck me, pluck me now and pluck me hard.' You know you want to.""
As a little girl or boy, what have you thought of the story of Eve of the Garden of Eden and the whispering snake? ’How stupid was Eve, to believe a snake?’, ‘A wise man would never do that to be fallen under its spell’?
White Forest: The background of the work is set as a space where your unconsciousness gets intertwined with something that can be restored to sensuous and physical matter. Deep under your consciousness, there are the desires structuring the basis of your thinking and behaviours, which then are visualised into the illusory space of white forest. Human desires have been the force driving the whole parts of human beings and given a rise to numerous actions and emotions including happiness, joy, sadness, and jealousy. These fruits might blur your own visions, distracting you to make a right decision, but it at the same time becomes a driving force of your life journey to move forward. Illusion is not a reflection of the reality, but a deformation, and it’s also a human desire that leads the fantasy.
So here we ask you once again. Now, at this place, the deepest part of the forest of your unconsciousness, you now hear the voice of snake whispering to you. The man with the fruit will bear fruits at the back of his mind. Eat the fruit and you can have the desires of your heart; it’s not evil, it’s noble, good, and even delicious. Here you are facing this raw, bare face of the 8th desire in the white forest. In front of this very beginning moment of the yet-unawakened desire, what would be your choice?","“Go on, my dear,"" urges the snake. ""Take one. Hear it? 'Pluck me,' it's saying. That big, shiny red one. 'Pluck me, pluck me now and pluck me hard.' You know you want to.""
뱀의 속삭임에 넘어간 에덴 동산의 이브를 보며 어린 시절의 당신은 무엇을 떠올렸는가?
작품의 배경인 흰 숲은 물질적이고, 의식적인 것으로 환원될 수 없는 당신의 무의식과 교차되는 공간이다. 무의식의 저변에 깔린 욕망은 당신의 의식과 사고, 행동을 조직하는 기초가 되어 흰 숲이라는 환상의 공간으로 가시화된다. 욕망은 태초부터 인간의 행위 전반의 근간이 되었으며 지금까지도 기쁨과 슬픔, 환희, 질투를 비롯한 수많은 행위들과 감정들을 낳는다. 이 산물들은 당신의 눈 앞을 흐림과 동시에 삶이란 여정에 추진력이 되어 당신을 나아가게 할 것이다. 환상은 현실의 반영이 아닌 현실의 변형으로, 이러한 환상을 이끌어나가는 것 역시 인간의 욕망이다.
우리는 지금의 당신에게 다시 한 번 묻는다. 지금 여기, 당신의 무의식의 숲 그 깊은 곳에서 뱀의 속삭임이 들려온다. 열매를 손에 넣은 자는 마음 속 깊이 자리잡은 욕망의 결실을 얻으리라. 그것은 결코 악하지 않으며, 고결하고 아름답고, 또한 탐스럽다. 깨어나지 못한 8번째 욕망의 시작, 그 맨얼굴과 마주했을 때 당신은 어떤 선택을 할 것인가?
당신의 환상이 우리의 작품을 가득 채울 것이며,
우리의 작품이 당신의 환상을 가득 채울 것이다.",EXHIBITION,Interactive Installation Media Art,인터렉티브 설치 미디어 아트,GroGHVQF88g,"박성은,이가윤,이지현,이화승",2016,19,7
0x90; Note on,0x90; Note on,"It is the strongest power of illusion that we work off our creative energy eventhough we can’t realize that in the constraints of life. We want to represent the moment that people can experience the power of illusion, using the light in the space.
People will touch the light bulbs - the main objet which has the light in the limited shape - and make sounds. With a line of 8 light bulbs and their sounds, we can feel another harmony. ‘0x90’ is a MIDI command which means ‘Note On’ and in this artwork, we all become performers who make sounds from the light and design multimodal interaction that stir each other’s various feelings.","“Creation beyond Imagination”
일상의 제약 안에서 실감할 수 없음에도 창조적 에너지를 발산하는 것이야 말로 환상이 가지는 강력한 힘이다. 우리는 빛이라는 자연적 요소를 공간 속에 녹여 환상의 힘을 감각적으로 경험할 수 있는 순간을 재현해보고자 이 작품을 기획하였다.
관람객은 한정된 형태 내에 빛을 담고 있는 중심 오브제인 전구를 직접 만지며 소리를 빚어내고, 한 줄로 늘어선 8개의 전구와 그들의 사운드를 통해 또 다른 조화로움을 느끼게 된다. 
0x90은 특정한 음을 연주하라(Note On)는 의미의 미디 명령어로, 본 작품에서 우리 모두는 빛을 통해 사운드를 만들어내는 연주자가 되어 서로의 다채로운 감각을 자극할 멀티모달 인터랙션을 직접 디자인하게 될 것이다.",EXHIBITION,Installation Media Art,설치 미디어아트,hayIXtMVtGY,"박선우,박채린,이희수,천용희",2016,20,8
Gye(System),계(系),"Fantasy itself is a system or a structure. It is not a detailed phenomenon that can be specified into one state, but the inner system of the human being itself is a fantasy. The moment we recognize the existence of one object makes us to get far away from that object, because we get trapped by the structure as fantasy. We cannot get out of the structure until we face the object completely into the front. And we are not able to get out of the sense of loss of losing the structure when we bail out of the structure. This is what we call fantasy. Fantasy is flowing inside ourselves, filling our system at this very moment. ","환상은 하나의 계, 혹은 구조다. 어떤 특정지을 수 있는 구체적 현상이 아니라 사람의 내부에서의 시스템 자체가 환상이다. 어떤 객체가 있다면 그 객체를 인지하는 순간부터 우리는 그 객체와 멀어진다. 환상이라는 구조에 갇히기 때문이다. 그 객체를 전면적으로 마주하기 전까지 우리는 그 구조를 빠져나올 수 없다. 그리고 그 구조를 빠져나오는 순간 구조를 잃은 상실감에서 헤어나오지 못한다. 그것이 바로 환상이다. 환상은 지금도 우리 속을 흐른다.",EXHIBITION,Installation,설치,Re-G-qciFDE,조남준,2016,21,5
